search_term,name,price,stockcode,cup_price,cup_string,package_size,store
cheddar cheese,Westminster Cheese Chilli & Lime Cheddar | 150 GRAM,8.00,,,$8.00,,Coles
cheddar cheese,Lord Of The Fries Mac & Cheese Classic Cheddar | 150g,5.00,,,$5.00,,Coles
cheddar cheese,Ashgrove Bush Pepper Cheddar Cheese | 140g,6.75,,,"$6.75
Save $1.00",,Coles
cheddar cheese,Table Of Plenty Multipack Popped Rice Cakes Cheddar Cheese 6 Pack | 90g,3.00,,,"$3.00
Save $3.00",,Coles
cheddar cheese,Mersey Valley Club Ploughman's Cheddar Cheese | 235g,9.90,,,$9.90,,Coles
cheddar cheese,Uncle Tobys Le Snak Cheese Dip And Crackers Cheddar Kids Lunchbox Snack | 132g,6.70,,,$6.70,,Coles
cheddar cheese,Mersey Valley Club Pickled Onion Cheddar Cheese | 235g,9.90,,,$9.90,,Coles
cheddar cheese,Pyengana Traditional Cheddar | 150g,13.50,,,$13.50,,Coles
cheddar cheese,Black Jack Cheddar Spaccato | approx. 200g,4.00,,,$4.00,,Coles
white rice,Coles Long Grain White Microwave Rice | 250g,1.80,,,$1.80,,Coles
white rice,Sunrice Microwave Long Grain White Rice Cup 2x125g | 250g,2.10,,,"$2.10
Save $1.40",,Coles
white rice,Sunrice Australian Medium Grain White Rice | 5kg,19.00,,,$19.00,,Coles
white rice,Sunrice Premium Long Grain Rice | 2kg,5.30,,,$5.30,,Coles
white rice,Sunrice Australian Medium Grain White | 1kg,3.15,,,"$3.15
Save $1.35",,Coles
white rice,Coles White Rice | 1kg,3.00,,,$3.00,,Coles
white rice,Sunrice Low GI White Rice | 1kg,4.60,,,$4.60,,Coles
white rice,Sunrice Jasmine White Rice | 5kg,27.00,,,$27.00,,Coles
white rice,Sunrice Australian Medium Grain White Rice | 2kg,8.60,,,$8.60,,Coles
white rice,Coles Cheese White Rice Crackers | 100g,1.00,,,$1.00,,Coles
white rice,Coles BBQ Rice Crackers | 100g,1.00,,,$1.00,,Coles
white rice,Coles Seaweed Rice Crackers | 100g,1.00,,,$1.00,,Coles
white rice,Coles Plain Rice Crackers | 100g,1.00,,,$1.00,,Coles
pasta,Coles Durum Wheat Pasta Large Spirals | 500g,1.00,,,$1.00,,Coles
pasta,Continental Pasta & Sauce Family Bacon Carbonara | 145g,3.80,,,$3.80,,Coles
pasta,Continental Alfredo Family Pasta And Sauce | 145g,3.80,,,$3.80,,Coles
pasta,Latina Fresh Kids Dairy Mini Ravioli Pasta Beef & Vegetable | 200g,5.00,,,"$5.00
Save $1.00",,Coles
pasta,Continental Alfredo With Garlic & Herb Family Pasta & Sauce | 145g,3.80,,,$3.80,,Coles
pasta,Continental Pasta & Sauce Family Sour Cream Chives | 145g,3.80,,,$3.80,,Coles
pasta,Latina Fresh Kids Dairy Mini Ravioli Pasta Cheese & Vegetable | 200g,5.00,,,"$5.00
Save $1.00",,Coles
pasta,Latina Tomato & Garlic Pasta Sauce | 250g,4.40,,,"$4.40
Save $1.10",,Coles
pasta,Continental Cup A Pasta Macaroni & Cheese | 53g,2.00,,,$2.00,,Coles
pasta,Coles Simply Pasta Spirals | 500g,0.90,,,$0.90,,Coles
pasta,Coles Simply Pasta Penne | 500g,0.90,,,$0.90,,Coles
pasta,Coles Simply Pasta Spaghetti | 500g,0.90,,,$0.90,,Coles
pasta,Coles Durum Wheat Pasta Spaghetti | 500g,1.00,,,$1.00,,Coles
pasta,Coles Durum Wheat Pasta Penne Rigate | 500g,1.00,,,$1.00,,Coles
pasta,San Remo Spaghetti No 5 | 500g,2.50,,,$2.50,,Coles
pasta,Zafarelli Fusilli Pasta No 17 | 500g,2.00,,,$2.00,,Coles
pasta,Coles Durum Wheat Pasta Shells Large | 500g,1.00,,,$1.00,,Coles
pasta,Coles Durum Wheat Pasta Macaroni | 500g,1.00,,,$1.00,,Coles
pasta,Coles Durum Wheat Pasta Fettuccine | 500g,1.00,,,$1.00,,Coles
pasta,Cucina Matese Fusilli No.114 Italian Pasta | 500g,2.80,,,$2.80,,Coles
pasta,Coles Durum Wheat Pasta Rigatoni | 500g,1.00,,,$1.00,,Coles
pasta,San Remo Penne Rigati Pasta No 18 | 500g,2.50,,,$2.50,,Coles
pasta,San Remo Trivelle Spirals No 17 | 500g,2.50,,,$2.50,,Coles
pasta,Zafarelli Pennette Rigate No18 Pasta | 500g,2.00,,,$2.00,,Coles
pasta,San Remo Large Pasta Spirals No 53 | 500g,2.50,,,$2.50,,Coles
pasta,Coles Durum Wheat Pasta Bowties | 500g,1.00,,,$1.00,,Coles
pasta,Cucina Matese Rigatoni No.117 Italian Pasta | 500g,2.80,,,$2.80,,Coles
pasta,Zafarelli Lisio Piccolo Pasta No 40 | 500g,2.00,,,$2.00,,Coles
pasta,Barilla Pasta Penne Rigate | 500g,3.00,,,"$3.00
Save $0.50",,Coles
pasta,Barilla Pasta Fusilli | 500g,3.00,,,"$3.00
Save $0.50",,Coles
pasta,Coles Kitchen Pasta Salad | 250g,4.00,,,$4.00,,Coles
pasta,Dr. Oetker Frozen Ristorante Pepperoni Pizza | 310g,9.50,,,$9.50,,Coles
pasta,Zafarelli Pasta Spaghetti No 4 | 500g,2.00,,,$2.00,,Coles
pasta,McCain Cheese & Bacon Pizza Slices 2 Pack | 600g,9.80,,,$9.80,,Coles
pasta,Cucina Matese Spaghetti No.113 Italian Pasta | 500g,2.80,,,$2.80,,Coles
pasta,McCain Meat Lovers Pizza Slices 2 Pack | 600g,9.80,,,$9.80,,Coles
pasta,Coles Beef Lasagne | 1.8kg,12.50,,,$12.50,,Coles
pasta,Barilla Pasta Spaghetti No 5 | 500g,3.00,,,"$3.00
Save $0.50",,Coles
pasta,Latina Fresh Beef Ravioli Pasta 4 Serve | 625g,11.00,,,$11.00,,Coles
pasta,Ready Chef Beef Lasagne | 1.9kg,16.50,,,$16.50,,Coles
pasta,Cucina Matese Penne Rigate No.118 Italian Pasta | 500g,2.80,,,$2.80,,Coles
pasta,Latina Fresh Lasagne Sheets 8 Pack | 375g,6.00,,,$6.00,,Coles
pasta,Coles Kitchen Beef Ravioli Pasta | 600g,6.00,,,$6.00,,Coles
pasta,San Remo Pasta Instant Spaghetti | 500g,2.50,,,$2.50,,Coles
pasta,San Remo Plain Fettuccine Pasta | 500g,2.50,,,$2.50,,Coles
pasta,Cucina Matese Pasta Fettuccine | 500g,2.80,,,$2.80,,Coles
pasta,Latina Fresh Beef Ravioli Pasta | 375g,5.60,,,"$5.60
Save $2.40",,Coles
pasta,San Remo Pasta Thin Spaghetti | 500g,2.50,,,$2.50,,Coles
pasta,Dr. Oetker Frozen Ristorante Spinaci (Spinach) Pizza | 390g,9.50,,,$9.50,,Coles
pasta,San Remo Linguine Pasta No 1 | 500g,2.50,,,$2.50,,Coles
pasta,Zafarelli Spirali Pasta No 56 | 500g,2.00,,,$2.00,,Coles
pasta,Zafarelli Pasta Spaghettini No 3 | 500g,2.00,,,$2.00,,Coles
pasta,Barilla Pasta Risoni | 500g,3.00,,,"$3.00
Save $0.50",,Coles
pasta,San Remo Tubular Spaghetti No 6 | 500g,2.50,,,$2.50,,Coles
pasta,Coles Kitchen Pasta Agnolotti Ricotta | 600g,6.00,,,$6.00,,Coles
rolled oats,Coles Oats Rolled | 900g,1.95,,,$1.95,,Coles
rolled oats,Red Tractor Australian Rolled Oats | 1kg,5.00,,,"$5.00
Save $1.00",,Coles
rolled oats,Red Tractor Organic Rolled Oats | 1kg,7.00,,,"$7.00
Save $1.00",,Coles
rolled oats,Uncle Tobys Porridge Oats Quick | 1kg,6.50,,,$6.50,,Coles
rolled oats,Uncle Tobys Porridge Oats Original | 1kg,6.50,,,$6.50,,Coles
rolled oats,Uncle Tobys Oats Quick Sachets Breakfast Cereal Creamy Honey | 700g,10.00,,,$10.00,,Coles
rolled oats,Uncle Tobys Oats Quick Sachets Berry Variety | 350g,7.00,,,$7.00,,Coles
rolled oats,Coles Rolled Oats Value Pack | 1.8 kg,3.50,,,$3.50,,Coles
rolled oats,Coles Quick Oats | 900g,1.95,,,$1.95,,Coles
rolled oats,Coles Organic Rolled Oats | 500g,3.00,,,$3.00,,Coles
rolled oats,Uncle Tobys Traditional Rolled Oats | 500g,4.50,,,$4.50,,Coles
rolled oats,Coles Quick Oats | 1.8kg,3.50,,,$3.50,,Coles
rolled oats,Coles Organic Quick Oats | 500g,3.00,,,$3.00,,Coles
rolled oats,Red Tractor Wheat Free Rolled Oats | 600g,6.30,,,"$6.30
Save $0.70",,Coles
rolled oats,Uncle Tobys Quick Oats Porridge | 500g,4.50,,,$4.50,,Coles
rolled oats,Coles Quick Oats Honey Flavoured Sachets 12 Pack | 420g,3.70,,,$3.70,,Coles
rolled oats,Uncle Tobys Oats Quick Sachets Milo | 280g,3.50,,,"$3.50
Save $3.50",,Coles
rolled oats,Bellamy's Organic Porridge Baby Cereal | 125g,3.95,,,$3.95,,Coles
rolled oats,Paleo Pure Power Porridge Sugar Free | 300g,15.00,,,$15.00,,Coles
rolled oats,Uncle Tobys Oats Quick Sachets Breakfast Cereal Original Big Bowl | 368g,5.50,,,"$5.50
Save $1.50",,Coles
rolled oats,Bellamy's Organic Pouch Banana Apple Porridge | 120g,2.30,,,$2.30,,Coles
rolled oats,Paleo Pure Power Porridge Berries And Cinnamon | 300g,15.00,,,$15.00,,Coles
rolled oats,Uncle Tobys Oats Quick Sachets Creamy Honey | 350g,7.00,,,$7.00,,Coles
rolled oats,Uncle Tobys Oats Quick Sachets Creamy Vanilla | 350g,7.00,,,$7.00,,Coles
rolled oats,Uncle Tobys Oats Quick Sachets Classic Variety | 350g,7.00,,,$7.00,,Coles
rolled oats,Uncle Tobys Oats Quick Sachets Protein Variety | 280g,7.00,,,$7.00,,Coles
rolled oats,Uncle Tobys Oats Quick Sachets Breakfast Cereal Original | 680g,10.00,,,$10.00,,Coles
rolled oats,Uncle Tobys Oats Quick Sachets Brown Sugar & Cinnamon | 350g,7.00,,,$7.00,,Coles
rolled oats,Uncle Tobys Sachets Oats Quick 10 Pack | 340g,7.00,,,$7.00,,Coles
rolled oats,Uncle Tobys Oats Quick Sachets Berry Protein Big Bowl | 368g,5.50,,,"$5.50
Save $1.50",,Coles
rolled oats,Uncle Tobys Oats Quick Sachets Big Bowl Vanilla Protein | 368g,5.50,,,"$5.50
Save $1.50",,Coles
rolled oats,Uncle Tobys Oats Quick Sachets Breakfast Cereal Hi Fibre | 320g,7.00,,,$7.00,,Coles
rolled oats,Carman's Porridge Sachets Apple Sultana & Cinnamon 8 Pack | 320g,7.50,,,$7.50,,Coles
rolled oats,Carman's Porridge Sachets Super Berry & Coconut 8 Pack | 320g,7.50,,,$7.50,,Coles
rolled oats,Carman's Oat Cups Protein Porridge Creamy Honey 2 Pack | 100g,6.50,,,$6.50,,Coles
rolled oats,Carman's Porridge Sachets Honey Vanilla & Cinnamon 8 Pack | 320g,7.50,,,$7.50,,Coles
rolled oats,Uncle Tobys Oats Quick Sachets Breakfast Cereal Creamy Honey Big Bowl | 368g,5.50,,,"$5.50
Save $1.50",,Coles
rolled oats,Carman's Porridge Sachets Protein Rich Almond Vanilla & Cinnamon 6 Pack | 270g,7.50,,,$7.50,,Coles
rolled oats,Carman's Porridge Sachets Natural 5 Grain & Super Seed 8 Pack | 320g,7.50,,,$7.50,,Coles
rolled oats,Rafferty's Garden Banana Pear & Mango Porridge Baby Food Pouch 6+ Months | 120g,2.30,,,$2.30,,Coles
rolled oats,Rafferty's Garden Apple Pear & Cinnamon Porridge Baby Food Pouch 6+ Months | 120g,2.30,,,$2.30,,Coles
rolled oats,Farex Creamy Baby Porridge With Apple Juice Baby Food Pouch 6+ Months | 120g,1.80,,,$1.80,,Coles
rolled oats,Coles Kitchen Honey Porridge High Protein | 260g,4.00,,,$4.00,,Coles
rolled oats,Bokomo Pro Nutro Original Instant Porridge Cereal | 500g,8.00,,,$8.00,,Coles
wraps,Coles Soft White Wraps 8 Pack | 360g,2.20,,,$2.20,,Coles
wraps,Bfree Low Carb High Protein Wraps | 210g,7.40,,,"$7.40
Save $1.00",,Coles
wraps,Bfree Sweet Potato Wraps | 210g,8.40,,,$8.40,,Coles
wraps,Mission Original Wraps 8 Pack | 567g,5.50,,,$5.50,,Coles
wraps,Coles Wholemeal & Grain Soft Wraps 8 Pack | 360g,2.20,,,$2.20,,Coles
wraps,Helga's White Wraps 8 Pack | 508g,3.50,,,"$3.50
Save $2.00",,Coles
wraps,Coles White Large Jumbo Wraps 8 Pack | 560g,4.20,,,$4.20,,Coles
wraps,Mission Spinach & Herb Wraps 8 Pack | 567g,5.50,,,$5.50,,Coles
wraps,Mission Wholegrain Wraps 8 Pack | 567g,5.50,,,$5.50,,Coles
wraps,Helga's Wholemeal Wraps 8 Pack | 508g,3.50,,,"$3.50
Save $2.00",,Coles
wraps,Mission Original  Mini Wraps 8 Pack | 384g,5.00,,,$5.00,,Coles
wraps,Helga's Mixed Grain Wraps 8 Pack | 508g,3.50,,,"$3.50
Save $2.00",,Coles
wraps,Mission Roasted Garlic Wraps 8 Pack | 567g,5.50,,,$5.50,,Coles
wraps,Helga's Spinach & Garden Herb Wraps 7 Pack | 445g,3.50,,,"$3.50
Save $2.00",,Coles
wraps,Coles Resealable Sandwich Bags | 50 pack,2.20,,,$2.20,,Coles
wraps,Simson's Pantry Low Carb High Protein + Fibre 6 Pack | 420g,6.50,,,$6.50,,Coles
wraps,Coles Burrito Tortilla Wraps 10 Pack | 400g,3.65,,,$3.65,,Coles
wraps,Mission Lite Wrap 8 Pack | 567g,5.50,,,$5.50,,Coles
wraps,Mission Soft & Fluffy Wrap 12 Pack | 450g,4.50,,,$4.50,,Coles
wraps,Simson's Pantry Low Carb High Protein 5 Pack | 225g,5.50,,,$5.50,,Coles
wraps,Simson's Pantry Preservative Free Mixed Wholegrain Large Wraps 8 Pack | 528g,5.00,,,$5.00,,Coles
wraps,Simson's Pantry Preservative Free Premium White Large Wraps 8 Pack | 528g,5.00,,,$5.00,,Coles
wraps,Coles Street Tortilla Wraps 10 Pack | 280g,3.75,,,$3.75,,Coles
wraps,Mission Wraps Low Gi Wholemeal 6 Pack | 425g,5.50,,,$5.50,,Coles
wraps,Coles Turkish Rolls 4 pack | 400g,2.60,,,$2.60,,Coles
wraps,Coles Simply Sandwich Slices 24 Pack | 500g,4.40,,,$4.40,,Coles
wraps,Coles Simply Smokey Flavoured Sandwich Slices 12 Pack | 250g,3.80,,,$3.80,,Coles
wraps,Coles Small Resealable Storage Bags | 50 pack,1.50,,,$1.50,,Coles
wraps,Coles Dairy Cheese Camembert Wrapped | 125g,3.00,,,$3.00,,Coles
wraps,Coles Medium Resealable Storage Bags | 30 pack,2.80,,,$2.80,,Coles
wraps,Hercules Clickzip Sandwich Bags 18cm x 16.5cm | 40 pack,2.35,,,$2.35,,Coles
wraps,Coles Large Resealable Storage Bags | 20 pack,2.40,,,$2.40,,Coles
wraps,Mission Souvlaki Bread | 320g,4.50,,,$4.50,,Coles
wraps,Coles Simply Cling Wrap | 60 metre,1.50,,,$1.50,,Coles
wraps,Coles Bags Freezer Large | 40 pack,0.80,,,$0.80,,Coles
wraps,Glad Cling Wrap | 30m,3.25,,,$3.25,,Coles
wraps,Mission Salt Reduced Wraps 8 pack | 567g,5.50,,,$5.50,,Coles
wraps,Glad Cling Wrap | 60m,4.50,,,"$4.50
Save $0.75",,Coles
wraps,Mountain Bread Rye Wraps 8 Pack | 200g,4.90,,,$4.90,,Coles
wraps,Glad Cling Wrap | 100m,6.30,,,$6.30,,Coles
wraps,Coles Jumbo Tortilla Wraps 6 Pack | 545g,4.70,,,$4.70,,Coles
wraps,Hercules Clickzip Snack Bags Small 15cm x 10cm | 40 pack,2.35,,,$2.35,,Coles
wraps,Coles Brown Paper Lunch Bags | 100 Pack,4.00,,,$4.00,,Coles
wraps,Mission Pita Pocket Original | 420g,4.40,,,$4.40,,Coles
wraps,Mountain Bread Natural Wraps 8 Pack | 200g,4.90,,,$4.90,,Coles
wraps,MEB Foods Pockets Wholemeal Pita | 250g,2.60,,,$2.60,,Coles
wraps,Mission Whole Wheat Mini Wraps 8 Pack | 384g,5.00,,,$5.00,,Coles
wraps,Simson's Pantry Low Carb Garlic & Herb + Protein | 420g,6.50,,,$6.50,,Coles
wraps,Simson's Pantry Low Carb Keto 5 Pack | 200g,6.00,,,$6.00,,Coles
wraps,Simson's Pantry Low Carb Mini 6 Pack | 156g,5.00,,,$5.00,,Coles
olive oil,La Espanola Extra Virgin Olive Oil | 1L,26.00,,,$26.00,,Coles
olive oil,Cobram Ultra Premium Picual Extra Virgin Olive Oil | 500mL,20.00,,,"$20.00
Save $5.00",,Coles
olive oil,Cobram Estate Ultra Premium Coratina Extra Virgin Olive Oil | 500mL,20.00,,,"$20.00
Save $5.00",,Coles
olive oil,Cobram Estate Ultra Premium Hojiblanca Extra Virgin Olive Oil | 500mL,20.00,,,"$20.00
Save $5.00",,Coles
olive oil,La Espanola Extra Virgin Olive Oil | 500mL,16.00,,,$16.00,,Coles
olive oil,Coles Extra Virgin Olive Oil | 1L,14.00,,,$14.00,,Coles
olive oil,La Espanola Mild & Light Olive Oil | 1L,26.00,,,$26.00,,Coles
olive oil,Red Island Extra Virgin Olive Oil | 1L,20.00,,,"$20.00
Save $5.00",,Coles
olive oil,Coles Extra Virgin Olive Oil | 500mL,9.00,,,$9.00,,Coles
olive oil,Monini Classico Extra Virgin Olive Oil | 750mL,22.00,,,$22.00,,Coles
olive oil,Cobram Estate Extra Virgin Olive Oil Classic | 375mL,11.00,,,"$11.00
Save $2.00",,Coles
olive oil,Squeaky Gate Australian Extra Virgin Olive Oil All Rounder | 750mL,20.00,,,$20.00,,Coles
olive oil,La Espanola Olive Oil Mild Flavour | 1L,26.00,,,$26.00,,Coles
olive oil,Coles Classic Olive Oil | 1L,14.00,,,$14.00,,Coles
olive oil,Coles Classic Olive Oil | 500mL,9.00,,,$9.00,,Coles
olive oil,Cobram Estate Extra Virgin Olive Oil | 750mL,25.00,,,$25.00,,Coles
olive oil,Coles Australian Extra Virgin Olive Oil | 1L,20.00,,,$20.00,,Coles
olive oil,La Espanola Mild & Light Olive Oil | 500mL,16.00,,,$16.00,,Coles
olive oil,La Espanola Organic Extra Virgin Olive Oil | 1L,28.00,,,$28.00,,Coles
olive oil,Red Island Extra Virgin Olive Oil | 250mL,7.00,,,$7.00,,Coles
olive oil,Moro Primero Extra Virgin Olive Oil | 1L,16.00,,,"$16.00
Save $11.00",,Coles
olive oil,Monini Organic Premium Selection Extra Virgin Olive Oil | 500mL,17.50,,,$17.50,,Coles
olive oil,Red Island Extra Virgin Olive Oil | 3L,60.00,,,$60.00,,Coles
olive oil,Cobram Estate Extra Virgin Olive Oil Classic | 3L,65.00,,,$65.00,,Coles
olive oil,Cobram Estate Extra Virgin Olive Oil Light | 375mL,11.00,,,"$11.00
Save $2.00",,Coles
olive oil,Cobram Estate Light Extra Virgin Olive Oil | 750mL,25.00,,,$25.00,,Coles
olive oil,La Espanola Extra Virgin Olive Oil Spray | 200mL,6.00,,,"$6.00
Save $1.50",,Coles
olive oil,Coles Organic Extra Virgin Olive Oil | 500mL,10.00,,,$10.00,,Coles
olive oil,Cobram Estate Extra Virgin Olive Oil Light Spray | 225g,9.50,,,$9.50,,Coles
olive oil,Moro Primero Extra Virgin Olive Oil | 500mL,16.00,,,$16.00,,Coles
olive oil,Coles Extra Mild Olive Oil | 1L,14.00,,,$14.00,,Coles
olive oil,Cobram Estate Extra Virgin Olive Oil Robust | 750mL,25.00,,,$25.00,,Coles
olive oil,Always Fresh Olive Oil & Sea Salt Crustini Bruschetta Toasts | 120g,4.50,,,$4.50,,Coles
olive oil,Coles Extra Mild Olive Oil | 500mL,9.00,,,$9.00,,Coles
olive oil,Cobram Estate Garlic Infused Extra Virgin Olive Oil | 500mL,19.50,,,$19.50,,Coles
olive oil,Cobram Estate Extra Virgin Olive Oil Robust | 375mL,11.00,,,"$11.00
Save $2.00",,Coles
olive oil,Red Island Extra Virgin Olive Oil | 500mL,11.50,,,$11.50,,Coles
olive oil,Moro El Delicado Light Taste Olive Oil | 1L,16.00,,,"$16.00
Save $11.00",,Coles
olive oil,Cobram Estate Garlic Infused Extra Virgin Olive Oil | 250mL,9.90,,,$9.90,,Coles
olive oil,Moro Tradicional Olive Oil | 1L,16.00,,,"$16.00
Save $11.00",,Coles
olive oil,Moro Delicado Light Taste Olive Oil | 500mL,16.00,,,$16.00,,Coles
olive oil,La Espanola Extra Virgin Olive Oil | 3.78L,36.00,,,"$36.00
Save $4.00",,Coles
olive oil,Moro Primero Extra Virgin Olive Oil | 4L,65.00,,,$65.00,,Coles
olive oil,Cobram Estate Garlic And Onion Infused Oil | 250mL,9.90,,,$9.90,,Coles
olive oil,Cobram Estate Lemon Infused Extra Virgin Olive Oil | 250mL,9.90,,,$9.90,,Coles
olive oil,Cobram Estate Chilli Infused Extra Virgin Olive Oil | 250mL,9.90,,,$9.90,,Coles
olive oil,La Espanola Extra Virgin Olive Oil | 4L,55.00,,,$55.00,,Coles
olive oil,Moro El Tradicional Pure Olive Oil | 4L,65.00,,,$65.00,,Coles
olive oil,Moro EL Delicado Light Taste Olive Oil | 4L,65.00,,,$65.00,,Coles
olive oil,La Espanola Olive Oil | 3.78L,36.00,,,"$36.00
Save $4.00",,Coles
butter,Western Star Spreadable Blend Original Soft | 500g,7.90,,,$7.90,,Coles
butter,Western Star Spreadable Blend Supersoft | 500g,7.90,,,$7.90,,Coles
butter,Meadow Lea Original Margarine Spread | 1kg,6.65,,,$6.65,,Coles
butter,Olive Grove Classic Olive Oil Margarine Tub | 500g,6.00,,,$6.00,,Coles
butter,Western Star Spreadable Blend Reduced Salt | 500g,7.90,,,$7.90,,Coles
butter,Meadow Lea Original Margarine Spread | 500g,4.50,,,$4.50,,Coles
butter,Coco Earth Grass Fed Ghee Butter | 500mL,11.70,,,"$11.70
Save $1.30",,Coles
butter,Western Star Spreadable Butter Blend Original | 375g,6.30,,,$6.30,,Coles
butter,Coles Salted Butter | 500g,7.50,,,$7.50,,Coles
butter,Coles Simply Salted Butter | 500g,7.00,,,$7.00,,Coles
butter,Coles Simply Regular Spread | 1Kg,2.80,,,$2.80,,Coles
butter,Coles Simply Salted Butter | 250g,4.00,,,$4.00,,Coles
butter,Coles Simply Unsalted Butter | 250g,4.00,,,$4.00,,Coles
butter,Western Star Dairy Butter Pat | 250g,5.50,,,$5.50,,Coles
butter,Coles Salted Butter | 250g,4.80,,,$4.80,,Coles
butter,Coles Dairy Unsalted Butter Pat | 250g,4.80,,,$4.80,,Coles
butter,Western Star Dairy Butter | 500g,8.90,,,$8.90,,Coles
butter,Devondale Dairy Soft Dy Blend Tub Regular | 500g,6.70,,,$6.70,,Coles
butter,Lurpak Butter Spreadable Slightly Salted | 400g,8.30,,,$8.30,,Coles
butter,Mainland Butter Soft Salted Spreadable Butter | 375g,9.90,,,$9.90,,Coles
butter,Devondale Regular Butter Blend | 500g,6.70,,,$6.70,,Coles
butter,Devondale Regular Pat Butter | 250g,4.70,,,$4.70,,Coles
butter,Coles Buttery Blend Spread | 500g,4.90,,,$4.90,,Coles
butter,Devondale Butter Block Unsalted | 250g,4.70,,,$4.70,,Coles
butter,Lurpak Butter Spreadable Slightly Salted | 250g,6.50,,,$6.50,,Coles
butter,Western Star Chef's Choice Unsalted Cultured | 500g,8.90,,,$8.90,,Coles
butter,Devondale Extra Soft Butter Less Fat | 750g,9.95,,,$9.95,,Coles
butter,Coles Olive Oil Spread | 500g,3.50,,,$3.50,,Coles
butter,Coles Simply Regular Spread | 500g,2.20,,,$2.20,,Coles
butter,Nuttelex Buttery Spread | 500g,4.00,,,"$4.00
Save $1.20",,Coles
butter,Western Star Spreadable Blend Supersoft | 375g,6.30,,,$6.30,,Coles
butter,Nuttelex Original Spread | 500g,4.00,,,"$4.00
Save $1.20",,Coles
butter,Western Star Dairy Butter Unsalted Cultured | 250g,5.50,,,$5.50,,Coles
butter,Mainland Butter Soft Salt Reduced Spreadable Butter | 375g,9.90,,,$9.90,,Coles
butter,Flora ProActiv Margarine Spread Buttery | 500g,7.00,,,"$7.00
Save $3.00",,Coles
butter,Flora Margarine Spread Original | 500g,4.50,,,$4.50,,Coles
butter,Flora Proactiv Margarine Spread Original | 750g,12.00,,,$12.00,,Coles
butter,Flora Margarine Spread Original | 1kg,7.00,,,$7.00,,Coles
butter,Lurpak Butter Slightly Salted | 250g,6.50,,,"$6.50
Save $0.75",,Coles
butter,Nuttelex Olive Spread | 500g,5.80,,,$5.80,,Coles
butter,Western Star Dairy Butter Unsalted | 250g,5.50,,,$5.50,,Coles
butter,Coles Organic Salted Butter | 250g,5.20,,,$5.20,,Coles
butter,Flora Pro Activ Margarine Spread Original | 500g,7.00,,,"$7.00
Save $3.00",,Coles
butter,Flora Margarine Spread Buttery | 1kg,7.00,,,$7.00,,Coles
butter,Flora Proactiv Margarine Spread Light | 500g,7.00,,,"$7.00
Save $3.00",,Coles
butter,Flora Margarine Spread Buttery | 500g,4.50,,,$4.50,,Coles
butter,Tru-Blue Garlic Butter Spread | 150g,3.35,,,$3.35,,Coles
butter,Tablelands Reduce Cholesterol Spread | 500g,5.25,,,$5.25,,Coles
butter,Devondale Dairy Soft Salt Reduced Spreadable Butter | 500g,6.70,,,$6.70,,Coles
bananas,Coles Bananas | approx. 180g,0.88,,,$0.88,,Coles
bananas,Coles Bananas Mini Pack | 750g,4.90,,,$4.90,,Coles
bananas,Coles Banana Muffins 9 Pack | 315g,4.50,,,$4.50,,Coles
bananas,Coles Organic Banana | approx. 170g,1.10,,,$1.10,,Coles
bananas,Life Savers Bananas | 160g,2.50,,,"$2.50
Save $2.50",,Coles
bananas,Coles Squeezie Banana Yoghurt Pouch | 70g,0.80,,,$0.80,,Coles
bananas,Coles Banana Bread Slices 5 Pack | 500g,5.75,,,$5.75,,Coles
bananas,Creative Gourmet Frozen Banana Chunks | 500g,5.00,,,$5.00,,Coles
bananas,Yoplait Petit Miam Squeezie Banana Yoghurt Pouch | 70g,0.90,,,"$0.90
Save $0.30",,Coles
bananas,Coles Banana Muffin Bars 10 Pack | 420g,6.60,,,$6.60,,Coles
bananas,Coles Banana Bread | 550g,5.80,,,$5.80,,Coles
bananas,Creative Gourmet Banana Mango Pineapple | 400g,5.65,,,$5.65,,Coles
bananas,Wicked Sister High Protein Banana Pudding | 170g,3.30,,,$3.30,,Coles
bananas,Coles Banana Chips | 200g,3.40,,,$3.40,,Coles
bananas,Green's Banana Bread Loaf Mix | 400g,3.00,,,$3.00,,Coles
bananas,Vaalia Kids Yoghurt Pouch Banana | 140g,2.50,,,$2.50,,Coles
bananas,Tamar Valley Kids Greek Pouch Yoghurt Banana | 110g,2.50,,,$2.50,,Coles
bananas,Coles Reduced Sugar Banana Bread Slices | 500g,5.75,,,$5.75,,Coles
bananas,YoPro High Protein Yoghurt Pouch No Added Sugar Banana | 150g,3.20,,,$3.20,,Coles
bananas,YoPro Perform High Protein Banana Yoghurt No Added Sugar | 175g,3.90,,,$3.90,,Coles
bananas,YoPro High Protein Yoghurt No Added Sugar Banana | 160g,3.20,,,$3.20,,Coles
bananas,Noshu 95% Sugar Free Banana Bread Slices | 240g,7.50,,,$7.50,,Coles
bananas,Coles Banana Custard Pouch | 90g,1.20,,,$1.20,,Coles
bananas,Coles Bake & Create Banana Bread Mix | 450g,2.35,,,$2.35,,Coles
bananas,Oob Organic Frozen Banana | 450g,8.00,,,$8.00,,Coles
bananas,Banana Joe Hickory BBQ Banana Chips | 46.8g,4.00,,,$4.00,,Coles
bananas,Banana Joe Banana Chips Sea Salt | 46.8g,4.00,,,$4.00,,Coles
bananas,Banana Joe Thai Sweet Chili Banana Chips | 46.8g,4.00,,,$4.00,,Coles
apples,Coles Pink Lady Apples Medium | approx. 200g,1.78,,,$1.78,,Coles
apples,Coles Royal Gala Apples Loose | approx. 170g,1.34,,,$1.34,,Coles
apples,Coles Pink Lady Apples | 1kg,8.90,,,$8.90,,Coles
apples,Coles Apple Granny Smith Medium | approx. 170g,1.34,,,$1.34,,Coles
apples,Coles Apples Mini Pack | 1kg,7.50,,,$7.50,,Coles
apples,Coles Royal Gala Apples 1kg | 1 each,7.90,,,$7.90,,Coles
apples,Coles Granny Smith Apples | 1kg,7.90,,,$7.90,,Coles
apples,Coles I'm Perfect Apples Prepacked | 2kg,7.90,,,$7.90,,Coles
apples,Coles Kanzi Red Apples | approx. 200g,1.50,,,$1.50,,Coles
apples,Coles I'm Perfect Pears Prepacked | 1.5kg,5.50,,,$5.50,,Coles
apples,Coles Apple Juice | 2L,2.70,,,$2.70,,Coles
apples,Kellogg's K-time Baked Twists Raspberry & Apple Flavour Filled Snack Bars 5 Pack | 185g,5.50,,,$5.50,,Coles
apples,Coles Apple Slices In Juice | 410g,2.25,,,$2.25,,Coles
apples,Ardmona Apple Pie Slices Canned | 800g,5.50,,,$5.50,,Coles
apples,Coles Bakery Apple Fresh Cream Turnover | 1 each,5.20,,,$5.20,,Coles
apples,Coles Apple & Mango Juice | 2L,2.70,,,$2.70,,Coles
apples,Golden Circle 100% Apple Juice No Added Sugar Fruit Juice | 2L,4.80,,,$4.80,,Coles
apples,Coles Bakery Apple Crown Danish | 2 pack,3.75,,,$3.75,,Coles
apples,Coles Bakery Mini Apple Crown | 5 pack,3.50,,,$3.50,,Coles
apples,Golden Circle Tetra Drink Apple Blackcurrant 250ml | 6 Pack,3.50,,,"$3.50
Save $2.00",,Coles
apples,Coles Apple & Cinnamon Muffins 4 Pack | 420g,4.50,,,$4.50,,Coles
apples,Coles Apple & Blackcurrant Juice | 2L,2.70,,,$2.70,,Coles
apples,Golden Circle Tetra Drink Apple 250ml | 6 Pack,3.50,,,"$3.50
Save $2.00",,Coles
apples,Coles 4 Pack Snack Fruit Pie Apples | 500g,4.50,,,$4.50,,Coles
apples,Coles Apple Sauce | 375g,2.00,,,$2.00,,Coles
apples,Waterfords Sparkling Water Apple Berry | 1L,2.00,,,$2.00,,Coles
apples,Nanna's Apple Snack  Pies 4 Pack | 450g,6.50,,,$6.50,,Coles
apples,Coles Apple & Blackcurrant Fruit Drink 250ml | 6 Pack,3.15,,,$3.15,,Coles
apples,Coles Apple Fruit Drink 250ml | 6 Pack,3.15,,,$3.15,,Coles
apples,Diet Rite Apple Raspberry Cordial | 1L,3.50,,,$3.50,,Coles
apples,Coles Apple & Raspberry Fruit Drink Multipack 250ml | 6 Pack,3.15,,,$3.15,,Coles
apples,Bob Snail Fruit Roll Snack Apple Strawberry | 60g,3.50,,,"$3.50
Save $1.00",,Coles
apples,Just Juice 100% Juice Apple 200ml | 6 Pack,6.50,,,$6.50,,Coles
apples,Diet Rite Apple Blackcurrant Cordial | 1L,3.50,,,$3.50,,Coles
apples,Golden Circle Tetra Drink Apple Raspberry | 6 Pack,3.50,,,"$3.50
Save $2.00",,Coles
apples,Coles Ambrosia Apples | approx. 180g,0.81,,,$0.81,,Coles
apples,Coles Apple Juice 250ml | 6 Pack,3.30,,,$3.30,,Coles
apples,Just Juice Apple Juice | 1L,3.50,,,$3.50,,Coles
apples,Rafferty's Garden Apple & Raspberry Snack Bars With Real Fruit Baby Food Snack 12+ Months | 128g,5.50,,,$5.50,,Coles
apples,Coles Organic Royal Gala Apples | 1kg,4.50,,,$4.50,,Coles
apples,Cottees Zero Sugar Cordial Apple & Raspberry | 1L,2.60,,,"$2.60
Save $0.05",,Coles
apples,Little Bellies Softcorn Berry & Apple | 8g,2.15,,,$2.15,,Coles
apples,Little Bellies Apple & Cinnamon Baby Puffs | 12g,2.15,,,$2.15,,Coles
apples,Rafferty's Garden Blueberry Banana & Apple Snack Bars Real Fruit Baby Food 8 Pack 12+ Months | 128g,5.50,,,$5.50,,Coles
apples,Apple Grove Sparkling 750ml | 750mL,2.90,,,$2.90,,Coles
