search_term,name,price,stockcode,cup_price,cup_string,package_size,store
eggs,Coles Free Range Eggs 12 Pack | 700g,6.50,,,$6.50,,Coles
eggs,Coles Free Range Eggs 12 Pack | 600g,6.20,,,$6.20,,Coles
eggs,Coles Cage Free Eggs 12 Pack | 700g,5.80,,,$5.80,,Coles
eggs,Coles Jumbo Free Range Eggs 12 Pack | 800g,7.25,,,$7.25,,Coles
eggs,Coles Free Range Eggs 6 Pack | 300g,4.20,,,$4.20,,Coles
eggs,Sunny Queen Free Range Extra Large Eggs 12 Pack | 700g,8.80,,,$8.80,,Coles
eggs,Sunny Queen Free Range Large Eggs 18 Pack | 900g,11.70,,,"$11.70
Save $1.00",,Coles
eggs,Coles Cage Free Eggs 18 Pack | 900g,8.40,,,$8.40,,Coles
eggs,Pace Farm Eggs For Everyone Free Range 12 Pack | 700g,7.75,,,$7.75,,Coles
eggs,Sunny Queen Cage Free Large Eggs 18 Pack | 900g,9.00,,,"$9.00
Save $1.70",,Coles
eggs,Sunny Queen Free Range X Large Eggs 6 Pack | 350g,5.20,,,$5.20,,Coles
eggs,Good Yolk Co Cage Free Eggs 12 Pack | 700g,6.50,,,$6.50,,Coles
eggs,Sunny Queen Free Range Large Eggs 12 Pack | 600g,8.50,,,$8.50,,Coles
eggs,Coles Organic Free Range Eggs 12 Pack | 600g,10.60,,,$10.60,,Coles
eggs,Sunny Queen Free Range X-large Eggs 30 Pack | 1.75kg,17.00,,,$17.00,,Coles
eggs,Sunny Queen Organic Eggs 12 Pack | 700g,13.00,,,$13.00,,Coles
eggs,Good Yolk Co Cage Free Eggs 12 Pack | 600g,6.20,,,$6.20,,Coles
eggs,Pace Farm Eggs For Everyone Free Range 12 Pack | 800g,9.75,,,$9.75,,Coles
eggs,Sunny Queen Free Range Big Brekkie Browns Eggs 12 Pack | 820g,10.20,,,$10.20,,Coles
eggs,Pace Farm Eggs For Everyone Cage Free 12 Pack | 700g,6.50,,,$6.50,,Coles
eggs,Josh's Rainbow Free Range Eggs 12 Pack | 700g,9.30,,,$9.30,,Coles
eggs,Sunrise Free Range Eggs 12 Pack | 700g,7.40,,,$7.40,,Coles
eggs,Pace Farm Eggs For Everyone Cage Free 12 Pack | 600g,6.00,,,$6.00,,Coles
eggs,Pace Farm Eggs For Everyone Free Range 12 Pack | 600g,7.50,,,$7.50,,Coles
eggs,Yarra Valley Free Range Eggs 12 Pack | 700g,7.50,,,$7.50,,Coles
eggs,Fyfe Family Farm Free Range Eggs 12 Pack | 700g,9.30,,,$9.30,,Coles
eggs,Sunny Queen Organic Free Range Large Eggs 6 Pack | 300g,7.00,,,$7.00,,Coles
eggs,Yallamundi Farm Organic Free Range Eggs 12 Pack | 700g,14.00,,,$14.00,,Coles
eggs,Josh's Rainbow Free Range Eggs 18 Pack | 900g,11.90,,,$11.90,,Coles
eggs,Coles Cage Free Eggs 12 Pack | 800g,6.40,,,$6.40,,Coles
eggs,Mornington Peninsula Free Range 12 Pack | 700g,9.10,,,$9.10,,Coles
eggs,Mornington Peninsula Free Range 6 Pack | 330g,5.30,,,$5.30,,Coles
eggs,Mornington Peninsula Free Range Eggs 12 Pack | 800g,9.60,,,$9.60,,Coles
eggs,Josh's Rainbow Free Range Eggs 12pack | 800g,10.50,,,$10.50,,Coles
eggs,Cadbury Dairy Milk Easter Chocolate Eggs Bag | 243g,13.00,,,$13.00,,Coles
eggs,Cadbury Dairy Milk Hollow Chocolate Easter Egg | 100g,7.00,,,$7.00,,Coles
eggs,Cadbury Crunchie Hollow Chocolate Easter Egg | 110g,7.00,,,$7.00,,Coles
eggs,Coles Finest Italian Chocolate Mini Easter Eggs Pistachio Creme & Milk Chocolate | 120g,5.50,,,$5.50,,Coles
eggs,Coles Finest Sea Salt & Caramel Almond Nougat Milk Chocolate Eggs | 120g,5.50,,,$5.50,,Coles
eggs,M&Ms Crispy Chocolate Speckled Easter Egg Bag | 130g,4.90,,,"$4.90
Save $2.10",,Coles
eggs,Cadbury Caramilk Easter Chocolate Eggs Bag | 113g,7.50,,,$7.50,,Coles
eggs,Cadbury Crunchie Easter Chocolate Eggs Bag | 110g,7.50,,,$7.50,,Coles
eggs,Darrell Lea Nougat Milk Chocolate Egg | 150g,13.00,,,$13.00,,Coles
eggs,Cadbury Mini Eggs Chocolate Easter Bunny | 160g,10.00,,,$10.00,,Coles
eggs,Cadbury Selections Large Easter Chocolate Eggs Bag | 545g,17.50,,,$17.50,,Coles
eggs,Lindt Lindor Easter Assorted Chocolate Eggs Bag | 90g,7.50,,,$7.50,,Coles
eggs,Cadbury Creme Egg Chocolate Easter Gift Box | 170g,13.50,,,$13.50,,Coles
eggs,Darrell Lea Speckled Easter Eggs | 120g,7.50,,,$7.50,,Coles
full cream milk,Coles Full Cream Milk | 3L,4.65,,,$4.65,,Coles
full cream milk,Pauls Zymil Lactose Free Full Cream Milk | 2L,6.80,,,$6.80,,Coles
full cream milk,Pauls Zymil Lactose Free Full Cream Milk | 1L,3.90,,,$3.90,,Coles
full cream milk,Pauls Zymil Lactose Free Milk Full Cream | 3L,9.50,,,$9.50,,Coles
full cream milk,Coles Full Cream Milk | 2L,3.20,,,$3.20,,Coles
full cream milk,Coles Australian Full Cream Long Life Milk | 1L,1.65,,,$1.65,,Coles
full cream milk,Coles Dairy Full Cream Milk | 1L,1.65,,,$1.65,,Coles
full cream milk,Devondale Full Cream Long Life Milk | 1L,2.20,,,$2.20,,Coles
full cream milk,Pauls Farmhouse Gold Full Cream Milk | 1.5L,4.70,,,$4.70,,Coles
full cream milk,Pura Full Cream Milk | 2L,3.95,,,"$3.95
Save $0.55",,Coles
full cream milk,Devondale Full Cream Milk | 3L,5.95,,,$5.95,,Coles
full cream milk,Coles Lactose Free Long Life Full Cream Milk | 1L,2.00,,,$2.00,,Coles
full cream milk,Devondale Full Cream Milk | 2L,4.00,,,$4.00,,Coles
full cream milk,Pauls Farmhouse Gold Cream On Top Milk | 1.5L,4.70,,,$4.70,,Coles
full cream milk,a2 Milk Full Cream Milk | 1L,3.90,,,$3.90,,Coles
full cream milk,Pura Milk Full Cream | 3L,5.80,,,"$5.80
Save $0.70",,Coles
full cream milk,Devondale Uht Full Cream Multipack Milk 200ml | 6 pack,5.40,,,$5.40,,Coles
full cream milk,Coles Full Cream Milk | 600mL,1.30,,,$1.30,,Coles
full cream milk,Pura Full Cream Milk | 1L,2.90,,,$2.90,,Coles
full cream milk,Liddells Lactose Free Full Cream Milk | 1L,2.70,,,$2.70,,Coles
full cream milk,a2 Milk Full Cream Milk | 2L,6.90,,,$6.90,,Coles
full cream milk,a2 Milk Full Cream Milk | 3L,9.90,,,$9.90,,Coles
full cream milk,Geelong Full Cream Milk | 2L,4.50,,,$4.50,,Coles
full cream milk,Great Ocean Road Full Cream Milk | 3L,6.00,,,$6.00,,Coles
full cream milk,Gippsland Jersey Full Cream Milk | 2L,5.80,,,$5.80,,Coles
full cream milk,Farmhouse Gold Full Cream Milk | 750mL,3.15,,,$3.15,,Coles
full cream milk,Riverina Fresh Full Cream Milk | 2L,4.80,,,$4.80,,Coles
full cream milk,Great Ocean Road Fresh Full Cream Milk | 2L,4.70,,,$4.70,,Coles
full cream milk,Great Ocean Road Fresh Full Cream Milk | 1L,2.90,,,$2.90,,Coles
full cream milk,a2 Milk Full Cream Uht Milk | 1L,3.90,,,$3.90,,Coles
full cream milk,The Complete Dairy High Protein Full Cream Milk | 1L,3.70,,,$3.70,,Coles
full cream milk,East Coast Sustainable Organic Full Cream Milk | 2L,6.90,,,$6.90,,Coles
full cream milk,Pauls Smarter White Milk 2% Fat Full Cream Taste | 2L,4.85,,,$4.85,,Coles
full cream milk,Pauls Smarter White Milk 2% Fat Full Cream Taste Bottle | 1L,3.20,,,$3.20,,Coles
full cream milk,Australia's Own Full Cream Milk | 1L,1.80,,,$1.80,,Coles
full cream milk,a2 Milk Lactose Free Full Cream Milk | 2L,6.90,,,$6.90,,Coles
full cream milk,a2 Milk Lactose Free Full Cream Milk | 1L,3.90,,,$3.90,,Coles
full cream milk,a2 Milk Lactose Free Full Cream Milk | 3L,9.90,,,$9.90,,Coles
full cream milk,Coles Full Cream Milk Powder | 1kg,10.50,,,$10.50,,Coles
full cream milk,Australia's Own A2 Protein Full Cream Milk | 1L,2.90,,,$2.90,,Coles
white bread,Tip Top The One Bread White Sliced | 700g,4.60,,,$4.60,,Coles
white bread,Abbott's Bakery Rustic White Bread | 700g,5.20,,,$5.20,,Coles
white bread,Wonder White Bread + Vitamins & Minerals | 700g,4.60,,,$4.60,,Coles
white bread,Coles White Bread | 650g,2.50,,,$2.50,,Coles
white bread,Tip Top The One White Toast Bread | 700g,4.60,,,$4.60,,Coles
white bread,Wonder Bread + Vitamins Toast | 700g,4.60,,,$4.60,,Coles
white bread,Coles High Fibre White Sandwich Bread | 700g,3.50,,,$3.50,,Coles
white bread,Wonder Bread Wholemeal Plus Iron | 700g,4.60,,,$4.60,,Coles
white bread,Coles High Fibre Wholemeal Bread | 700g,3.50,,,$3.50,,Coles
white bread,Coles Soft White Wraps 8 Pack | 360g,2.20,,,$2.20,,Coles
white bread,Coles Soft White Toast Loaf | 650g,2.80,,,$2.80,,Coles
white bread,Coles High Fibre White Toast Bread | 700g,3.50,,,$3.50,,Coles
white bread,Tip Top The One Wholemeal Sandwich Bread | 700g,4.60,,,$4.60,,Coles
white bread,Coles Soft White Sandwich | 650g,2.80,,,$2.80,,Coles
white bread,Tip Top White Bread Rolls Hamburger | 520g,4.90,,,$4.90,,Coles
white bread,Buttercup Country Split White Bread | 450g,4.30,,,$4.30,,Coles
white bread,Tip Top White Bread Rolls Hot Dog | 450g,4.90,,,$4.90,,Coles
white bread,Wonder Mini Loaf White Sandwich Vitamin | 320g,3.60,,,$3.60,,Coles
white bread,Coles Country Loaf White | 750g,4.20,,,$4.20,,Coles
white bread,Mighty Soft White Sandwich Bread | 700g,3.90,,,$3.90,,Coles
white bread,Tip Top Super Thick Toast Soft White Bread | 700g,4.60,,,$4.60,,Coles
white bread,Mighty Soft Wholemeal Sandwich Bread | 700g,3.90,,,$3.90,,Coles
white bread,Buttercup Country Split Bread Wholemeal | 450g,4.30,,,$4.30,,Coles
white bread,Wonder 5 Star White | 680g,4.60,,,"$4.60
Save $0.30",,Coles
white bread,Coles White Sandwich Loaf | 680g,3.10,,,$3.10,,Coles
white bread,Coles White Sandwich Loaf | 800g,3.60,,,$3.60,,Coles
white bread,Mountain Bread Natural Wraps 8 Pack | 200g,4.90,,,$4.90,,Coles
white bread,Coles Wholemeal Sandwich Loaf | 800g,3.60,,,$3.60,,Coles
white bread,Coles Multigrain Sandwich Loaf | 680g,3.10,,,$3.10,,Coles
white bread,Coles Wholemeal Sandwich Loaf | 680g,3.10,,,$3.10,,Coles
white bread,Coles Bread High Fibre Multigrain | 700g,3.50,,,$3.50,,Coles
white bread,Laucke White Crusty Calico Bag Bread Mix | 10kg,20.00,,,"$20.00
Save $7.60",,Coles
white bread,Laucke White Crusty Flour Bread Mix | 2.4kg,10.90,,,$10.90,,Coles
white bread,Abbott's Bakery Light Rye Bread | 680g,5.20,,,$5.20,,Coles
white bread,Abbott's Bakery Farmhouse Wholemeal Bread | 750g,5.20,,,$5.20,,Coles
white bread,Abbott's Bakery Harvest Seeds And Grain Bread | 750g,5.20,,,$5.20,,Coles
white bread,Laucke Barossa Sour Dough Bread Mix | 2.4kg,10.90,,,$10.90,,Coles
white bread,Abbott's Bakery Lower Carb White Bread | 600g,5.80,,,$5.80,,Coles
white bread,MEB White Khobz White 5 Pack | 500g,3.60,,,$3.60,,Coles
white bread,Abbott's Bakery Gluten Free Rustic White Bread | 500g,7.90,,,$7.90,,Coles
white bread,MEB Foods Fresh Pockets White Pita | 250g,2.60,,,$2.60,,Coles
white bread,Helga's White Wraps 8 Pack | 508g,3.50,,,"$3.50
Save $2.00",,Coles
white bread,Helgas Mini White | 335g,3.80,,,"$3.80
Save $0.40",,Coles
white bread,Helgas White Loaf | 700g,5.20,,,$5.20,,Coles
white bread,Wonder Gluten Free White | 470g,6.30,,,"$6.30
Save $0.70",,Coles
white bread,Simson's Pantry Preservative Free Premium White Large Wraps 8 Pack | 528g,5.00,,,$5.00,,Coles
white bread,Coles White Large Jumbo Wraps 8 Pack | 560g,4.20,,,$4.20,,Coles
white bread,Helga's Crafted Rustic White Sourdough | 700g,5.90,,,"$5.90
Save $0.80",,Coles
chicken breast,Coles RSPCA Approved Chicken Breast Fillets Large Pack | approx. 1.4kg,15.40,,,$15.40,,Coles
chicken breast,Coles RSPCA Approved Chicken Breast Fillets Small Pack | approx. 600g,8.70,,,$8.70,,Coles
chicken breast,Coles RSPCA Approved Free Range Chicken Breast Large Pack | approx. 1.25kg,17.50,,,$17.50,,Coles
chicken breast,Lilydale Free Range Chicken Breast Fillets Bulk | approx. 1kg,15.00,,,"$15.00
Save $2.50",,Coles
chicken breast,Coles RSPCA Approved Free Range Chicken Breast Fillet Small Pack | approx. 600g,10.80,,,$10.80,,Coles
chicken breast,Coles RSPCA Approved Chicken Breast Kyiv Garlic Butter | 700g,8.00,,,$8.00,,Coles
chicken breast,Coles Shredded Roast Chicken Breast | 150g,6.50,,,$6.50,,Coles
chicken breast,Coles Frozen Chicken Breast Nuggets | 400g,4.40,,,$4.40,,Coles
chicken breast,Primo Chicken Breast Thinly Sliced | 80g,3.95,,,$3.95,,Coles
chicken breast,Coles RSPCA Approved Chicken Breast Steaks Lemon & Herb | 500g,9.50,,,$9.50,,Coles
chicken breast,Lilydale Chicken Breast Schnitzels | 400g,12.00,,,$12.00,,Coles
chicken breast,Coles Sliced Peri Peri Roast Chicken Breast | 150g,6.50,,,$6.50,,Coles
chicken breast,Moira Mac's Roasted Chicken Breast Bbq | 350g,9.00,,,$9.00,,Coles
chicken breast,Coles RSPCA Approved Chicken Breast Schnitzel Plain Crumb | 600g,9.00,,,$9.00,,Coles
chicken breast,Coles RSPCA Approved Chicken Breast Schnitzel Garlic & Herb Crumb | 600g,9.00,,,$9.00,,Coles
chicken breast,Steggles Frozen Tempura Chicken Breast Nuggets | 400g,5.80,,,$5.80,,Coles
chicken breast,Coles RSPCA Approved Chicken Breast Fillet Crumb Sage & Rosemary | 400g,10.00,,,$10.00,,Coles
chicken breast,Steggles Frozen Classic Crumb Chicken Breast Tenders | 1kg,13.50,,,$13.50,,Coles
chicken breast,Steggles Frozen Crumbed Chicken Breast Nuggets | 400g,5.80,,,$5.80,,Coles
chicken breast,Coles Made Easy Chicken Breasts Filled With Garlic & Herb Butter Topped With A Cheese Crumb | 500g,13.50,,,$13.50,,Coles
chicken breast,Coles Chicken Breast Dino Nuggets | 1kg,9.00,,,$9.00,,Coles
chicken breast,Don Chicken Breast | 160g,6.60,,,$6.60,,Coles
chicken breast,Coles Rspca Chicken Creamy Garlic Breast Kyiv | 350g,10.00,,,$10.00,,Coles
chicken breast,Coles Free Range Chicken Breast Carved Roast | 200g,8.00,,,$8.00,,Coles
chicken breast,Lilydale Chicken Breast Strips Crumbed | 400g,11.00,,,$11.00,,Coles
chicken breast,El- Amin's Halal Chicken Breast Fillets Large Pack | approx. 1.3kg,16.90,,,$16.90,,Coles
chicken breast,Coles Free Range Chicken Breast Carved Roast Lemon Pepper & Herb | 200g,8.00,,,$8.00,,Coles
chicken breast,Inglewood Farms Free Range Organic Chicken Breast Fillets Skin Off | approx. 488g,16.84,,,$16.84,,Coles
chicken breast,Moira Mac Chicken Breast Roasted | 350g,9.00,,,$9.00,,Coles
chicken breast,The Deli Chicken Breast | 150g,4.00,,,$4.00,,Coles
chicken breast,Coles Finest Prosciutto Wrapped Chicken Breast | 500g,16.00,,,$16.00,,Coles
chicken breast,Moira Mac's Smoked Chicken Breast | 300g,8.50,,,$8.50,,Coles
chicken breast,The Bare Bird Chicken Breast Fillet | 600g,13.50,,,$13.50,,Coles
chicken breast,Lilydale Free Range Chicken Breast Fillet | 600g,13.00,,,$13.00,,Coles
chicken breast,Don Deli Cuts Chicken Breast Homestyle Seasoned | 80g,3.30,,,"$3.30
Save $1.00",,Coles
chicken breast,The Deli RSPCA Approved Sliced Bbq Chicken Breast | 150g,5.00,,,$5.00,,Coles
chicken breast,Coles Finest Chicken Breast Filled With Cous Cous & Moroccan Style Butter | 500g,16.00,,,$16.00,,Coles
chicken breast,Moira Macs Pulled Chicken Breast | 150g,6.00,,,$6.00,,Coles
chicken breast,Coles Sliced Greek Inspired Roast Chicken Breast | 150g,6.50,,,$6.50,,Coles
chicken breast,Coles Finest Boneless Chicken Prosciutto Wrapped Fromager D'affinois Honey & Fig Sauce | 1Kg,25.00,,,$25.00,,Coles
chicken breast,Fettayleh Chicken Breast Supreme | 150g,5.30,,,$5.30,,Coles
chicken breast,Coles Frozen Chicken Breast Schnitzel | 400g,5.50,,,$5.50,,Coles
chicken breast,The Bare Bird Chicken Breast Steak | 500g,13.50,,,$13.50,,Coles
chicken breast,Coles RSPCA Approved Chicken Breast Schnitzel | 500g,9.00,,,$9.00,,Coles
chicken breast,Coles RSPCA Approved Chicken Breast Diced | 500g,8.00,,,$8.00,,Coles
chicken breast,Maggi Gluten Free Recipe Bases Satay Chicken | 43g,1.85,,,$1.85,,Coles
chicken breast,El-Amins Chicken Breast Small Pack | approx 1kg,15.00,,,$15.00,,Coles
chicken breast,Lilydale Free Range Chicken Breast Diced | 500g,13.00,,,$13.00,,Coles
chicken breast,Continental Kosher Butchers Chicken Breast Fillet Smoked | approx. 500g,27.00,,,$27.00,,Coles
tuna can,Coles Simply Tuna Springwater | 425g,3.30,,,$3.30,,Coles
tuna can,Sirena Tuna With Beans Edamame & Sesame Dressing | 170g,3.70,,,"$3.70
Save $1.00",,Coles
tuna can,Sirena Tuna With Beans Mexican | 170g,3.70,,,"$3.70
Save $1.00",,Coles
tuna can,Sirena Tuna With Beans Chilli Italian Style | 170g,3.70,,,"$3.70
Save $1.00",,Coles
tuna can,Coles Spicy Chilli Tuna | 95g,1.10,,,$1.10,,Coles
tuna can,My Dog Classic Loaf With Sardine Tuna & Spring Vegetables Can Wet Dog Food | 400g,3.00,,,$3.00,,Coles
tuna can,Gefen Chunk Light Tuna In Water | 170g,4.00,,,$4.00,,Coles
tuna can,Whiskas 1+ Years Wet Cat Food Tuna Can | 400g,2.70,,,$2.70,,Coles
tuna can,Dine Desire Wet Cat Food Pure Tuna Whitemeat Can 6x85g | 6 pack,12.00,,,$12.00,,Coles
tuna can,Ultimates Chicken & Tuna Dog Food | 400g,2.00,,,"$2.00
Save $0.90",,Coles
tuna can,Callipo Solid Light Tuna In Olive Oil 2 Pack | 320g,9.00,,,$9.00,,Coles
tuna can,Dagim Tuna Chunk Light In Brine Kb | 170g,3.70,,,$3.70,,Coles
tuna can,Applaws Tuna Fillet Canned Cat Food | 70g,2.40,,,$2.40,,Coles
tuna can,Applaws Cat Food Tuna & Salmon | 70g,2.40,,,$2.40,,Coles
tuna can,Applaws Tuna Fillet with Seaweed Canned Cat Food | 70g,2.40,,,$2.40,,Coles
tuna can,Sirena Tuna In Springwater | 95g,2.95,,,$2.95,,Coles
tuna can,Sirena Tuna in Springwater | 185g,3.70,,,"$3.70
Save $1.00",,Coles
tuna can,Sirena Chilli Tuna | 185g,3.70,,,"$3.70
Save $1.00",,Coles
tuna can,Sirena Tuna Paella | 170GRAM,4.30,,,$4.30,,Coles
tuna can,Sirena Original Tuna & Beans | 185g,3.70,,,"$3.70
Save $1.00",,Coles
tuna can,Sirena Tuna Chilli | 425g,7.50,,,$7.50,,Coles
tuna can,Coles Simply Tuna In Brine | 425g,3.30,,,$3.30,,Coles
tuna can,Wild Tides Tuna Springwater | 95g,1.70,,,$1.70,,Coles
tuna can,Coles Simply Tuna In Springwater | 185g,1.70,,,$1.70,,Coles
tuna can,Wild Tides Tuna Smokey | 95g,1.70,,,$1.70,,Coles
tuna can,Ultimates Indulge Responsibly Fished Tuna & Barramundi Cat Food Canned | 85g,2.00,,,$2.00,,Coles
tuna can,Sirena Tuna In Springwater | 425g,7.50,,,$7.50,,Coles
tuna can,Coles Smoke Flavour Tuna | 95g,1.10,,,$1.10,,Coles
tuna can,Coles Tuna Mexican Style | 95g,1.10,,,$1.10,,Coles
tuna can,Coles Tuna Lemon & Pepper | 95g,1.10,,,$1.10,,Coles
tuna can,Coles Tuna Tomato & Basil | 95g,1.10,,,$1.10,,Coles
tuna can,Coles Tuna Sweet Chilli | 95g,1.10,,,$1.10,,Coles
tuna can,Coles Tuna Zesty Vinaigrette | 95g,1.10,,,$1.10,,Coles
tuna can,Sirena Lite Tuna Chilli | 95g,2.95,,,$2.95,,Coles
tuna can,Sirena Tuna in Oil Italian Style | 185g,3.70,,,"$3.70
Save $1.00",,Coles
tuna can,Sirena Soy & Ginger Tuna | 95g,2.95,,,$2.95,,Coles
tuna can,Wild Tides Tuna Olive Oil | 95g,1.70,,,$1.70,,Coles
tuna can,Coles Simply Tuna In Vegetable Oil | 425g,3.30,,,$3.30,,Coles
tuna can,Coles Simply Tuna In Vegetable Oil | 185g,1.70,,,$1.70,,Coles
tuna can,Wild Tides Tuna Spicy Chilli | 95g,1.70,,,$1.70,,Coles
tuna can,Wild Tides Tuna Sweet Chilli | 95g,1.70,,,$1.70,,Coles
tuna can,Wild Tides Tuna Tomato & Basil | 95g,2.50,,,$2.50,,Coles
tuna can,Wild Tides Tuna Lemon And Pepper | 95g,1.70,,,$1.70,,Coles
tuna can,Sirena Tuna Chilli Oil | 95g,2.95,,,$2.95,,Coles
tuna can,Sirena Springwater & Lemon Tuna | 95g,2.95,,,$2.95,,Coles
tuna can,John West Chunk Style Tuna in Brine | 425g,6.30,,,$6.30,,Coles
tuna can,John West Chunk Style Tuna in Springwater | 425g,6.30,,,$6.30,,Coles
tuna can,Sirena Garlic Infused Tuna In Oil | 95g,2.95,,,$2.95,,Coles
tuna can,John West Tuna Sweet Chilli | 95g,1.45,,,"$1.45
Save $1.45",,Coles
tuna can,John West Tuna Chilli | 95g,1.45,,,"$1.45
Save $1.45",,Coles
tuna can,Sirena Limited Edition Triple Chilli Tuna | 95g,2.95,,,$2.95,,Coles
greek yogurt,Coles Greek Style Natural Yoghurt | 1kg,4.30,,,$4.30,,Coles
greek yogurt,Kellogg's High Protein Granola Honey Nut | 450g,6.30,,,"$6.30
Save $2.70",,Coles
greek yogurt,Five Am No Added Sugar Organic Yoghurt Greek Style | 700g,7.00,,,$7.00,,Coles
greek yogurt,Farmers Union Greek Style Natural Yoghurt | 1kg,6.95,,,$6.95,,Coles
greek yogurt,Farmers Union Greek Style Yoghurt Natural | 500g,4.90,,,$4.90,,Coles
greek yogurt,Jalna Greek Style Natural Yoghurt | 1kg,8.80,,,$8.80,,Coles
greek yogurt,Coles Light Greek Style Yoghurt | 1kg,4.30,,,$4.30,,Coles
greek yogurt,Farmers Union Regular Greek Yoghurt 4x160g | 640g,6.50,,,$6.50,,Coles
greek yogurt,Chobani Greek Yogurt Natural Light | 907g,7.90,,,$7.90,,Coles
greek yogurt,Farmers Union Light Greek Style Yoghurt | 1kg,6.95,,,$6.95,,Coles
greek yogurt,Tamar Valley Greek Yoghurt | 1kg,8.00,,,$8.00,,Coles
greek yogurt,Farmers Union Greek Style Yoghurt Natural | 240g,3.40,,,$3.40,,Coles
greek yogurt,Jalna Pot Set Yoghurt Natural Greek | 170g,2.00,,,$2.00,,Coles
greek yogurt,Farmers Union Greek Style Vanilla Yoghurt | 950g,6.95,,,$6.95,,Coles
greek yogurt,Jalna Dairy Yoghurt Greek Style | 2kg,13.50,,,"$13.50
Save $1.50",,Coles
greek yogurt,Farmers Union Greek Yoghurt Pouch Vanilla | 130g,2.50,,,$2.50,,Coles
greek yogurt,Farmers Union Greek Yoghurt Pouch Strawberry | 130g,2.50,,,$2.50,,Coles
greek yogurt,Chobani Greek Yogurt Natural Light | 160g,2.70,,,$2.70,,Coles
greek yogurt,Farmers Union Greek Style High Protein Yoghurt Natural | 500g,4.90,,,$4.90,,Coles
greek yogurt,Farmers Union Greek Yoghurt Pouch Mango | 130g,2.50,,,$2.50,,Coles
greek yogurt,Farmers Union Greek Style Yoghurt Pouch Natural | 130g,2.50,,,$2.50,,Coles
greek yogurt,Farmers Union Greek Yoghurt Pouch Passionfruit | 130g,2.50,,,$2.50,,Coles
greek yogurt,Chobani Greek Yogurt Natural Whole Milk | 907g,7.90,,,$7.90,,Coles
greek yogurt,Chobani Greek Yogurt Vanilla | 907g,7.90,,,$7.90,,Coles
greek yogurt,Jalna Greek Style Sweet & Creamy Yoghurt | 1kg,8.80,,,$8.80,,Coles
greek yogurt,Chobani Greek Yogurt Strawberry | 160g,2.70,,,$2.70,,Coles
greek yogurt,Jalna Sweet & Creamy Greek Yoghurt | 2kg,13.50,,,"$13.50
Save $1.50",,Coles
greek yogurt,Chobani Greek Yogurt Mango | 160g,2.70,,,$2.70,,Coles
greek yogurt,Chobani Greek Yogurt Passionfruit | 160g,2.70,,,$2.70,,Coles
greek yogurt,Chobani Greek Yogurt Vanilla | 160g,2.70,,,$2.70,,Coles
greek yogurt,Jalna Farm To Pot Organic Yoghurt Greek | 1kg,9.00,,,$9.00,,Coles
greek yogurt,Chobani Greek Yogurt Lemon | 160g,2.70,,,$2.70,,Coles
greek yogurt,Chobani Greek Yogurt Raspberry | 160g,2.70,,,$2.70,,Coles
greek yogurt,Chobani Greek Yogurt Blueberry | 160g,2.70,,,$2.70,,Coles
greek yogurt,Chobani Greek Yogurt Honey | 160g,2.70,,,$2.70,,Coles
greek yogurt,Jalna Greek Yoghurt Lactose Free | 170g,2.20,,,$2.20,,Coles
greek yogurt,Chobani Greek Yogurt Limited Edition | 160g,2.70,,,$2.70,,Coles
greek yogurt,Chobani No Added Sugar Greek Yogurt Strawberry | 150g,2.70,,,$2.70,,Coles
greek yogurt,Tempo Foods Greek Style Yoghurt Value Pack | 700GRAM,11.00,,,$11.00,,Coles
greek yogurt,Procal Authentic Greek Yoghurt | 900g,7.00,,,$7.00,,Coles
greek yogurt,Chobani No Added Sugar Greek Yogurt Strawberry | 680g,6.80,,,$6.80,,Coles
greek yogurt,Coles Perform High Protein Greek Yoghurt | 900g,6.20,,,$6.20,,Coles
greek yogurt,Nature Valley Protein Bar Peanut & Chocolate | 160g,2.70,,,"$2.70
Save $2.70",,Coles
greek yogurt,Farmers Union Greek Style Yogurt | 2Kg,12.50,,,$12.50,,Coles
greek yogurt,Tamar Valley Greek Style Yoghurt | 500g,4.60,,,$4.60,,Coles
greek yogurt,Chobani No Sugar Added Greek Yogurt Blueberry | 680g,6.80,,,$6.80,,Coles
greek yogurt,Chobani No Added Sugar Yogurt Vanilla | 150g,2.70,,,$2.70,,Coles
greek yogurt,Carman's Greek Yoghurt & Berry Protein Bars | 200g,5.70,,,"$5.70
Save $2.80",,Coles
greek yogurt,Easiyo Greek Style Unsweetened Yoghurt | 170g,6.00,,,$6.00,,Coles
greek yogurt,Chobani Fit High Protein Greek Yogurt Strawberry | 160g,3.00,,,$3.00,,Coles
greek yogurt,Chobani Fit High Protein Greek Yogurt Passionfruit | 160g,3.00,,,$3.00,,Coles
cheddar cheese,Coles Cheese Shredded Tasty | 700g,9.50,,,$9.50,,Coles
cheddar cheese,Mersey Valley Club Original Cheddar Cheese | 235g,9.90,,,$9.90,,Coles
cheddar cheese,The Organic Milk Co Organic High Protein Cheddar Block | 250g,7.00,,,$7.00,,Coles
cheddar cheese,Cracker Barrel Extra Sharp Cheese Block | 250g,7.00,,,"$7.00
Save $2.20",,Coles
cheddar cheese,Cracker Barrel Extra Sharp Cheese Block | 500g,11.00,,,$11.00,,Coles
cheddar cheese,Mersey Valley Club Classic Cheddar Cheese | 235g,9.90,,,$9.90,,Coles
cheddar cheese,Mersey Valley Club Dairy Original Vintage Cheddar Cheese | 180g,6.20,,,"$6.20
Save $2.50",,Coles
cheddar cheese,Mersey Valley Club Vintage Dairy Extra Tasty Cheddar Cheese | 180g,6.20,,,"$6.20
Save $2.50",,Coles
cheddar cheese,Cracker Barrel Special Reserve Cheese Block | 250g,7.00,,,"$7.00
Save $2.20",,Coles
cheddar cheese,Castello Cheddar Cheese | 200g,8.80,,,$8.80,,Coles
cheddar cheese,Coles Simply Cheddar Cheese Block | 1Kg,9.30,,,$9.30,,Coles
cheddar cheese,Coles Dairy Shredded Tasty Cheese | 250g,5.50,,,$5.50,,Coles
cheddar cheese,Coles Cheese Shredded Tasty Light | 700g,9.50,,,$9.50,,Coles
cheddar cheese,Bega Cheddar Cheese Block | 500g,7.90,,,$7.90,,Coles
cheddar cheese,Bega Cheddar Cheese Block | 250g,5.00,,,$5.00,,Coles
cheddar cheese,Coles Finest Vintage British Cheddar | 200g,5.00,,,$5.00,,Coles
cheddar cheese,Mainland Extra Tasty Cheddar Cheese Block | 500g,11.00,,,$11.00,,Coles
cheddar cheese,The Organic Milk Co Organic Cheddar Block | 400g,8.00,,,$8.00,,Coles
cheddar cheese,Tempo Shredded Cheddar Cheese | 250g,7.90,,,$7.90,,Coles
cheddar cheese,Tempo Mild Cheddar Cheese Block | 1kg,28.00,,,$28.00,,Coles
cheddar cheese,Tempo Dairy Cheese Mild Cheddar | 250g,9.00,,,$9.00,,Coles
cheddar cheese,Tempo Reduced Fat Cheddar Cheese Block | 250g,7.90,,,$7.90,,Coles
cheddar cheese,Tempo Reduced Fat Cheddar Cheese Block | 1kg,29.00,,,$29.00,,Coles
cheddar cheese,Coles Organic Cheddar Shredded | 500g,10.50,,,$10.50,,Coles
cheddar cheese,The Organic Milk Co. Organic Shredded Cheddar | 250g,5.00,,,"$5.00
Save $1.50",,Coles
cheddar cheese,The Organic Milk Co Organic High Protein Cheddar Shred | 250g,7.00,,,$7.00,,Coles
cheddar cheese,Devondale Tasty Shredded Cheese | 750g,13.50,,,$13.50,,Coles
cheddar cheese,Bega Cheese Tasty Grated | 500g,9.50,,,$9.50,,Coles
cheddar cheese,Universal Shredded Tasty Cheese | 2Kg,27.00,,,$27.00,,Coles
cheddar cheese,Devondale Colby Cheese Shredded | 750g,13.50,,,$13.50,,Coles
cheddar cheese,Bega Cheese Grated Tasty | 250g,7.50,,,$7.50,,Coles
cheddar cheese,Bega Cheese Tasty Protein Grated | 250g,7.50,,,$7.50,,Coles
cheddar cheese,Brownes Dairy Matured Cheddar Cheese | 400g,9.90,,,$9.90,,Coles
cheddar cheese,Bio Shredded Cheddar Cheese | 200g,9.00,,,$9.00,,Coles
cheddar cheese,Bega Cheese Cheddar Slices | 250g,5.40,,,$5.40,,Coles
cheddar cheese,Bio Cheddar Cheese Slices | 200g,7.50,,,$7.50,,Coles
cheddar cheese,Cobs Gluten Free Popcorn Cheddar Cheese | 100g,3.50,,,$3.50,,Coles
cheddar cheese,Arnotts Shapes Light & Crispy Cheddar Cheese | 120g,2.00,,,"$2.00
Save $2.00",,Coles
cheddar cheese,The Good Crisp Co Potato Crisps Cheddar Cheese | 160g,4.50,,,$4.50,,Coles
cheddar cheese,Coles Chicken Burgers Zucchini & Cheddar Cheese | 450g,8.50,,,$8.50,,Coles
cheddar cheese,Ricos Gourmet Nacho Cheddar Cheese Sauce | 425g,8.00,,,$8.00,,Coles
cheddar cheese,Westminster Cheese Smoked English Cheddar | 150 GRAM,8.00,,,$8.00,,Coles
