search_term,name,price,stockcode,cup_price,cup_string,package_size,store
apples,Coles Organic Pink Lady Apple | 1kg,8.50,,,$8.50,,Coles
apples,Baby Mum-mum First Rice Rusk Apple & Pumpkin +6 Months | 36g,3.85,,,$3.85,,Coles
apples,True Fruit Strips Apple & Strawberry | 120g,6.00,,,$6.00,,Coles
potatoes,Coles Creme Gold Washed Potatoes Loose | approx. 150g,0.73,,,$0.73,,Coles
potatoes,Coles Potatoes Sweet Gold | approx. 500g,1.75,,,$1.75,,Coles
potatoes,Coles Potatoes Washed | 2kg,8.00,,,$8.00,,Coles
potatoes,Coles Brushed Potatoes | 2Kg,6.80,,,$6.80,,Coles
potatoes,Coles Baby Washed Potatoes | 1Kg,4.50,,,$4.50,,Coles
potatoes,Coles Red Royale Potatoes Loose | approx. 170g,0.83,,,$0.83,,Coles
potatoes,Coles Carisma Washed Potatoes | 2kg,8.00,,,$8.00,,Coles
potatoes,Coles Red Royale Washed Potatoes | 2Kg,6.00,,,$6.00,,Coles
potatoes,Coles Spud Lite Potatoes | 1.5Kg,6.50,,,$6.50,,Coles
potatoes,Coles Baby Carisma Potatoes | 1kg,4.50,,,$4.50,,Coles
potatoes,Coles Brushed Potatoes | 4Kg,9.00,,,$9.00,,Coles
potatoes,Coles Spud Lite Baby Potato | 750g,3.50,,,$3.50,,Coles
potatoes,Coles Baby Red Royale Potatoes | 1Kg,4.50,,,$4.50,,Coles
potatoes,Coles Frozen Potato Royals Oven Fry | 1kg,5.80,,,$5.80,,Coles
potatoes,McCain Frozen Hash Browns | 750g,5.80,,,$5.80,,Coles
potatoes,Coles I'm Perfect Sweet Potato | 1.5kg,3.90,,,$3.90,,Coles
potatoes,Coles Kestrel Washed Potatoes | 2Kg,7.50,,,$7.50,,Coles
potatoes,Coles Kitchen Vegetables Baby Potatoes Herb Butter | 400g,5.50,,,$5.50,,Coles
potatoes,McCain Superfries Frozen Potato Chips Shoestring | 900g,4.30,,,$4.30,,Coles
potatoes,McCain Superfries Frozen Potato Chips Crinkle Cut | 900g,4.30,,,$4.30,,Coles
potatoes,Coles Beer Battered Steakhouse Chips | 750g,4.50,,,$4.50,,Coles
potatoes,McCain Superfries Frozen Potato Chips Straight Cut | 900g,4.30,,,$4.30,,Coles
potatoes,McCain Pub Style Extra Crispy Fries | 750g,6.00,,,$6.00,,Coles
potatoes,Coles Frozen Australian Potato Chunky Wedges | 750g,4.50,,,$4.50,,Coles
potatoes,McCain Beer Batter Potato Chips Frozen Steak Cut | 750g,4.60,,,"$4.60
Save $1.20",,Coles
potatoes,Birds Eye Golden Crunch Potato Gems Bite Size Hash Brown | 900g,6.80,,,$6.80,,Coles
potatoes,McCain Pub Style Potato Wedges | 750g,6.00,,,$6.00,,Coles
potatoes,McCain Pub Style Fries | 750g,6.00,,,$6.00,,Coles
potatoes,Birds Eye Golden Crunch Crinkle Cut Chips | 900g,4.80,,,"$4.80
Save $1.20",,Coles
potatoes,Coles Frozen Sweet Potato Chips | 750g,5.00,,,$5.00,,Coles
potatoes,Coles Kitchen Potato Salad | 800g,7.00,,,$7.00,,Coles
potatoes,Birds Eye Golden Crunch Straight Cut Chips | 900g,4.80,,,"$4.80
Save $1.20",,Coles
potatoes,Coles Kitchen Potato Salad | 250g,4.00,,,$4.00,,Coles
potatoes,Coles Kitchen Creme Royale Potato Mash | 350g,5.50,,,$5.50,,Coles
potatoes,McCain Quick Cook Straight Cut | 750g,4.00,,,"$4.00
Save $0.60",,Coles
potatoes,Birds Eye Deli Sea Salt & Rosemary Seasoned Potato Chips | 600g,6.20,,,$6.20,,Coles
potatoes,Healtheries Potato Stix Chicken Multipack Kids Lunchbox Snacks 6x20g | 120g,5.00,,,$5.00,,Coles
potatoes,Coles Whole Baby Potatoes | 410g,2.00,,,$2.00,,Coles
potatoes,Guzzi's Traditional Potato Gnocchi | 500g,4.90,,,$4.90,,Coles
potatoes,Deb Instant Mashed Plain Potato | 350g,6.60,,,$6.60,,Coles
potatoes,Healtheries Potato Stix Roast Multipack Kids Lunchbox Snacks 6x20g | 120g,5.00,,,$5.00,,Coles
potatoes,Maggi Gluten Free Side Dishes Three Cheese Potato Bake | 21g,1.85,,,$1.85,,Coles
potatoes,Maggi Gluten Free Side Dishes Potato Bake Cheese And Garlic | 23g,1.85,,,$1.85,,Coles
potatoes,Coles Finest Truffled Potato Croquettes | 200g,7.00,,,$7.00,,Coles
potatoes,Maggi Gluten Free Side Dishes Potato Bake Cheese And Bacon | 21g,1.85,,,$1.85,,Coles
potatoes,Deb Instant Mashed Onion Potato | 115g,2.50,,,$2.50,,Coles
potatoes,Coles Kitchen Scalloped Potato | 350g,5.50,,,$5.50,,Coles
potatoes,Coles Organic Potatoes Brushed | 2Kg,11.50,,,$11.50,,Coles
brown onions,Coles Loose Brown Onions | approx. 200g,0.78,,,$0.78,,Coles
brown onions,Coles Brown Onions | 1kg,3.60,,,$3.60,,Coles
brown onions,Coles Brown Onion Shallots Loose | approx. 35g,0.46,,,$0.46,,Coles
brown onions,Fehlbergs Brown Pickled Onions | 500g,4.00,,,$4.00,,Coles
brown onions,Blue Banner Pickled Onions Brown Chilli | 525g,5.95,,,"$5.95
Save $1.05",,Coles
brown onions,Blue Banner Pickled Onions | 525g,5.95,,,"$5.95
Save $1.05",,Coles
brown onions,Three Threes Old Style Pickled Onions | 500g,5.25,,,$5.25,,Coles
brown onions,Coles Organic Brown Onions | 1Kg,6.90,,,$6.90,,Coles
brown onions,Gravox Brown Onion Gravy | 165g,3.50,,,$3.50,,Coles
brown onions,Gravox Brown Onion Gravy Mix Tin | 120g,4.00,,,"$4.00
Save $1.00",,Coles
